date,datayear,title,description,subject,categories,url
2023-02-03,2020,Galaxy mass prediction,Galaxies span a range of masses. Can students learn a statistical model that associates a galaxy’s mass with its brightness as measured at six wavelengths along with an estimate of its distance from the Earth?,astronomy,"linear regression, nonparametric regression",https://cmustatistics.github.io/data-repository/astronomy/buzzard.html
2025-11-05,2025,Effect of AI on programming productivity,Software engineers rapidly adopted generative AI tools to help write code. This randomized experiment evaluates whether AI use reduces the time required to complete tasks.,technology,"hierarchical model, EDA",https://cmustatistics.github.io/data-repository/technology/metr-ai.html
2024-06-25,2018,Bias in soccer refereeing,"Are dark-skinned soccer players more likely to receive red cards than those with light skin? Use observational data on several thousand players and referees to examine the association. This data was used in the Many Analysts, One Data Set project exploring how different analysis teams produce different statistical results.",psychology,GLMs,https://cmustatistics.github.io/data-repository/psychology/many-analysts.html
2023-07-25,2019,Nightly sleep time and GPA in first-years,Does nightly sleep duration predict change in end-of-semester grade point average (GPA)? First-year college students from three independent universities provided sleep actigraphy for a month early in their spring academic term across five studies.,psychology,"ANOVA, linear regression",https://cmustatistics.github.io/data-repository/psychology/cmu-sleep.html
2025-08-22,2021,Stress and cognitive-effort avoidance,Cognitive performance is diminished when we’re highly stressed. This experiment tried to evaluate whether this is because stressed subjects choose to avoid tasks that require cognitive effort. Use mixed effects models to evaluate the experimental results.,psychology,"experimental design, hierarchical model, logistic regression",https://cmustatistics.github.io/data-repository/psychology/stress-effort.html
2025-11-09,2023,Physical healing and time perception,"If the body affects the mind and the mind affects the body, it should by possible to influence the body by influencing the mind. This study manipulated perception of time to see if perceived, not actual, time would influence the rate at which wounds heal. Reinterpret a psychological experiment using linear and mixed models.",psychology,"linear regression, hierarchical model",https://cmustatistics.github.io/data-repository/psychology/healing-time.html
2022-11-04,2022,Makeup and male attractiveness,"Makeup is often used by women, but does makeup make men more attractive? This study had participants rate photos of men with and without makeup on.",psychology,"ANOVA, linear regression, hierarchical model",https://cmustatistics.github.io/data-repository/psychology/male-makeup.html
2018-06-18,2018,Testosterone and diversity,"When students work on group projects, they work better when their groups are diverse. This study asked if that depends on the testosterone level of the group, and if high-testosterone groups benefit less from diversity.",psychology,linear regression,https://cmustatistics.github.io/data-repository/psychology/hormone-diversity.html
2017-06-14,2017,Sugary drinks and portion limits,Public health officials are interested in policies that would reduce consumption of sugary drinks. What policies work and what policies backfire? A factorial experiment.,psychology,"ANOVA, logistic regression",https://cmustatistics.github.io/data-repository/psychology/sugary-drinks.html
2019-09-01,2019,Serving sizes and plate sizes,Do people eat more food if their meals are served on larger plates? A randomized experiment with demographic and psychological control variables.,psychology,"ANOVA, linear regression",https://cmustatistics.github.io/data-repository/psychology/plate-size.html
2017-02-25,2017,Religion and analytic thinking,A controversial study found that encouraging analytic thinking also reduced religious belief. A replication attempt collected much more data to try to confirm the hypothesis; is it supported by the data? A simple randomized experiment with continuous outcome and demographic controls.,psychology,"ANOVA, linear regression",https://cmustatistics.github.io/data-repository/psychology/religion-analytic-thinking.html
2017-02-24,2015,Resenting moral rebels,We usually applaud people who rebel against the status quo for moral reasons – but those involved in the status quo do not. An experiment attempts to understand why this is.,psychology,ANOVA,https://cmustatistics.github.io/data-repository/psychology/moral-rebels.html
2025-01-10,2024,Human-AI Parallel Corpus,"The Human-AI Parallel Corpus contains millions of words of text written by humans and by large language models (LLMs) such as OpenAI’s GPT-4o and Meta’s Llama 3. The texts have been annotated to identify rhetorical features, allowing comparison of the writing style of the different LLMs.",language,"EDA, multivariate analysis, text data, classification",https://cmustatistics.github.io/data-repository/language/hap-e.html
2024-08-30,2021,Fastest 100m sprint times,"Explore the 1,000 fastest times ever recorded for the 100m sprint, in men’s and women’s track, cleaning the data and conducting EDA.",sports,"data cleaning, EDA, split/apply/combine",https://cmustatistics.github.io/data-repository/sports/sprinters.html
2024-12-30,2024,January 6th insurrectionists,"Replicate a political science analysis of “the local political, economic, and social conditions of the communities that sent insurrectionists to the US Capitol in support of Donald Trump”, using observational data on counties in the United States and the number of their residents charged with crimes related to the January 6, 2021, attack on the United States Capitol.",politics,"GLMs, EDA",https://cmustatistics.github.io/data-repository/politics/jan-6-insurrectionists.html
2025-07-24,2025,"Social capital, income inequality, and political outcomes across US counties","County-level data combining social capital indices, income inequality measures, and economic indicators, inspired by Rodríguez-Pose, Lee, and Lipp’s “Golfing with Trump” research on social capital, decline, and populism. Join this with the January 6th insurrectionists dataset to examine relationships between social cohesion, economic conditions, and political outcomes across US counties.",politics,"EDA, linear regression, data cleaning, multivariate analysis",https://cmustatistics.github.io/data-repository/politics/social_capital.html
2023-06-20,2022,World Development Indicators,"The World Bank’s World Development Indicators (WDI) compile development information about countries around the world. Using ten years of data, study development, political stability, pollution, and other factors at the national and regional levels.",politics,"linear regression, ANOVA",https://cmustatistics.github.io/data-repository/politics/world-bank.html
2023-09-07,2020,Fiscally standardized cities,Extensive financial data on over 200 of the largest cities in the United States for over 40 years. Which cities spend the most or the least on government services?,politics,"EDA, clustering",https://cmustatistics.github.io/data-repository/politics/standard-cities.html
2017-02-22,2014,Science Forums,"A random sample of discussions at a large science discussion forum, with metadata about each.",social,"GLMs, classification, linear regression",https://cmustatistics.github.io/data-repository/social/science-forums.html
2023-11-08,2023,Elite college admissions,"We know that students at elite universities tend to be from high-income families, and that graduates are more likely to end up in high-status or high-income jobs. But very little public data has been available on university admissions practices. This dataset, collected by Opportunity Insights, gives extensive detail on college application and admission rates for 139 colleges and universities across the United States, including data on the incomes of students. How do admissions practices vary by institution, and are wealthy students overrepresented?",social,"EDA, ANOVA",https://cmustatistics.github.io/data-repository/social/elite-college-admissions.html
2025-07-01,1978,Boston Housing and fairness assessment,"Harrison and Rubinfeld collected and studied families’ willingness to pay for clean air through Boston housing market data in 1978. It was one of the standard toy datasets included in scikit-learn, but it has been critiqued and removed from the package for fairness issues. What can we learn from the problematic usage of sensitive attributes as predictive variables?",social,"linear regression, EDA, classification",https://cmustatistics.github.io/data-repository/social/bostonhousing.html
2024-09-29,2024,Survey of data visualization courses,"This dataset is a survey of data visualization courses across universities and liberal arts colleges, containing information for each course that was found. This includes which departments teach data visualization courses, as well as the types of statistics and data science topics that are covered.",social,"categorical data, data cleaning, EDA, text data",https://cmustatistics.github.io/data-repository/social/data-viz-survey.html
2025-07-29,2013,Bechdel Test and box office results,"The Bechdel test evaluates works of fiction based on whether they contain at least two women who talk to each other about something other than a man. It is often viewed as a proxy for gender bias in film and TV. Using a movie dataset from 1970 to 2013, we try to understand if passing the Bechdel test hurts or benefits the box office.",social,"EDA, linear regression, ANOVA",https://cmustatistics.github.io/data-repository/social/bechdel_test.html
2025-07-21,2018,Costa Rican household poverty level,"This dataset is useful for public policy and international development. Using data from a household survey in Costa Rica, you can predict a categorial outcome (level of household poverty) from observable household characteristics. Or, you can come up with your own questions, such as predicting female head of household based on household characterstics.",social,"EDA, data cleaning, surveys, linear regression, multivariate analysis, logistic regression, categorical data, clustering",https://cmustatistics.github.io/data-repository/social/costa_rica_households.html
2025-07-26,2023,Survey on attitude towards migrants,"This dataset is useful for public policy and causal analysis. In Mexico and the Dominican Republic, a survey was conducted on attitudes towards migrants. Each respondent receives one of two possible treatments (either an “emotive” or “informative” video about migrants), or is part of the placebo group (shown an unrelated video).",social,"EDA, causality, surveys, linear regression, multivariate analysis, logistic regression, experimental design",https://cmustatistics.github.io/data-repository/social/migrants.html
2019-08-14,2010,"House prices in Ames, Iowa","Records of homes sold in Ames, Iowa, and their sale prices, including detailed covariates that could be used to predict home prices.",money,"linear regression, nonparametric regression",https://cmustatistics.github.io/data-repository/money/ames-housing.html
2023-06-09,2021,European protected ham,"In Europe, some types of ham—like Black Forest ham—can only be legally produced in specific geographic regions. Does the size of those regions affect the price of the ham?",money,"ANOVA, linear regression, hierarchical model",https://cmustatistics.github.io/data-repository/money/european-ham.html
2022-07-27,2014,Rail trails and property values,"Rail trails are a great recreation opportunity, but do homes near them rise in value? A retrospective observational study of house values.",money,"linear regression, nonparametric regression",https://cmustatistics.github.io/data-repository/money/rail-trails.html
2023-09-06,2023,Mapping Police Violence,"Each year in the United States, around 1,000 people are killed by police. Some of these deaths are accidental, in traffic accidents and other incidents; some are deliberate killings considered legally justified by authorities; and others are considered unjustified or even lead to the prosecution of the police officer. Explore data on over 10,000 such killings to identify patterns in the people killed, the stated reasons for their killings, and the situations leading to their deaths.",crime-and-justice,"GLMs, linear regression, logistic regression",https://cmustatistics.github.io/data-repository/crime-and-justice/mapping-police-violence.html
2019-02-09,2015,Traffic stops in Connecticut,"Records for every traffic stop made by the Connecticut State Police over several years, including the reason for the stop and demographic details. Use classifiers to study whether stop and search decisions show signs of bias.",crime-and-justice,"classification, logistic regression",https://cmustatistics.github.io/data-repository/crime-and-justice/connecticut-stops.html
2023-05-17,2020,Core temperature during surgery,Is low core temperature during surgery associated with poor surgical outcomes or death? Use logistic and survival analysis to study an observational dataset.,medicine,"logistic regression, survival analysis",https://cmustatistics.github.io/data-repository/medicine/core-temperature.html
2025-05-08,1989,Distinguishing bacterial and viral meningitis,"Doctors treating meningitis must rapidly determine if it is caused by bacteria or a virus. Can this be predicted using fast, inexpensive tests, instead of slower bacterial and viral cultures? Use an observational sample of meningitis cases to build a classifier.",medicine,"logistic regression, classification",https://cmustatistics.github.io/data-repository/medicine/meningitis.html
2025-10-28,2011,Blood transfusions in prostatectomies,"When patients have prostatectomies to treat prostate cancer, the surgery may cause blood loss requiring a blood transfusion. Blood transfusions may cause adverse reactions and affect the immune system, so this could affect the success of the surgery and whether the prostate cancer recurs. Use logistic regression or survival analysis to explore an observational dataset of patients.",medicine,"logistic regression, survival analysis",https://cmustatistics.github.io/data-repository/medicine/prostatectomy.html
2023-06-08,1828,Bloodletting,"Bloodletting—deliberately withdrawing large amounts of blood from patients—was a common medical practice for centuries, until evidence was finally collected on its efficacy. Use an early observational dataset to explore its use for pneumonia.",medicine,"logistic regression, contingency tables",https://cmustatistics.github.io/data-repository/medicine/bloodletting.html
2022-12-08,2017,Health exams in Vietnam,"As access to health care increases, public health advocates encourage ordinary people to get regular check-ups to detect problems before they become serious (and expensive). But not everyone follows this advice. This survey of people in Vietnam explores the factors leading people to get regular check-ups.",medicine,"surveys, classification, logistic regression",https://cmustatistics.github.io/data-repository/medicine/vietnam-health.html
2023-08-08,2023,US College Scorecard,"An extensive survey of American colleges and universities, recording the demographics of their graduates, typical salaries, and much more.",daily-life,"linear regression, ANOVA",https://cmustatistics.github.io/data-repository/daily-life/college-scorecard.html
2023-08-08,2023,RTG tinned fish,"The Rainbow Tomatoes Garden sells hundreds of kinds of canned seafood, and produces a complete table including 27 different attributes, from Latin name to sodium content. Write code to clean the data, then analyze factors affecting price and composition.",daily-life,"logistic regression, data cleaning, ANOVA",https://cmustatistics.github.io/data-repository/daily-life/rtg-tinned-fish.html
2025-07-01,2015,Fandango movie ratings,Which site do you use for movie ratings? How much do you trust the ratings? Walt Hicker took this question seriously and investigated the difference between Fandango ratings and other major platforms.,daily-life,"EDA, data visualization, t-test",https://cmustatistics.github.io/data-repository/daily-life/fandango_movie_ratings.html
2022-12-08,2015,Insect attraction to light,What kinds of lights are insects most attracted to? Analyze the results of a factorial experiment using light traps.,biology,"GLMs, experimental design",https://cmustatistics.github.io/data-repository/biology/bug-attraction.html
2019-07-10,2019,Bird genetic diversity,Evolutionary theory suggests that species spread over a wider geographic range should have greater genetic diversity. Does this hold true in birds? An observational study of 387 bird species.,biology,"linear regression, hierarchical model",https://cmustatistics.github.io/data-repository/biology/bird-diversity.html
2021-12-27,2017,AnAge Longevity Database,"The AnAge database includes information on the longevity of thousands of animal species, allowing studies of the factors related to long lifespans.",biology,linear regression,https://cmustatistics.github.io/data-repository/biology/anage.html
2021-12-27,2020,Dry beans,Sort and classify beans using features extracted from images.,biology,classification,https://cmustatistics.github.io/data-repository/biology/dry-beans.html
2017-06-15,2017,Spider nuptial gifts and fraud,"Male spiders give “gifts” of silk-wrapped food to female spiders to convince them to mate. Sometimes, they may cheat by gifting something other than food. Under what conditions do they cheat, and how much silk do they use to wrap fake gifts? Analyze an experiment on spiders in the lab.",biology,"ANOVA, linear regression",https://cmustatistics.github.io/data-repository/biology/spider-nuptials.html
